review_id,book_id,title,author_id,name,user_id,rating,review_text,language,n_votes,date_added
 This is one of four novels that represent the era of The Old Republic and the second I've read (the first being Raven). This was the first to come out in the series and possibly the most difficult to get into. Darth Malgus is so far removed from being the standard 'bad arse' Sith. He loves to much and doubts himself (much like Darth Scrouge from Revan which I've mentioned in that review). I'm not sure if there was a conscious effort to try and portray a different archetypal Sith, but it seems a trend that runs through this series. 
 The main story is centred around a Jedi Knight, called Arrya, who thirsts for revenge against Darth Malgus (I've not given anything away from the story itself, see the trailer copied and pasted above). It's rather amusing to seeing a 'caring' Sith and a bloodthirsty Jedi. A trend which seems to be fairly A-typical lately \"let's go full-circle\" sorta-thing. Then you've got Malgus hunger for power and conflict within his own order, something not unusual when a Sith. What didn't sit too well with me was his battle with his perceived weakness; love for someone else. Why would a Darth so openly show his weakness to his fellow Sith, especially in battle? Why show a weaken side of yourself for other to exploit? It didn't feel right to me, and felt very convoluted when Malgus's story progressed with his obsession with Eleena throughout the prose. 
 The final player in the 3-pronged tale is a very stereotypical-Star-War-y smuggler. A rogue, a spice runner and a nice guy. Hmm. It was a nice touch to see how he was with his daughter, but other than that - the usual lustful awkwardness with Arrya was rather amusing and clumsily handled in my opinion. 
 I've spent my time revealing my difficulty with the three-dimensional characters and potential issues with the 'isms' of those characters. What I enjoyed; well Malgus does have his moments \"I just want to watch the world burn\" when referring to the sacking of Coruscent. His easy dismal of his peers amused me - his directness, avoiding politics and subtleties and just coming out with what he wished to say - which was a good foil for some of his, detractors within the Sith order of hierarchy. Z-man (aka the smuggler) touching moments with his handicapped daughter showed a different persona from the generic character, which was a joy to read. The gritty environment almost made me feel dirty, Malgus with his clear distaste of anyone, Arrya wishing harm on other's and Z-man being a drug runner; it made me feel dirty, DIRTY! 
 This was a fairly good introduction into The Old Republic series of novels. Sadly it looks like there won't be any more in the future after the first four, as the game has flopped. There is such rich potential here for future content. After all The Knights of the Old Republic really started the pre-Skywalker era. Give it a try if you're interested in a different feel to the Star Wars universe.",eng,7,Fri Mar 07 08:28:34 -0800 2014
f1be7cf617cc77f7be573df5d650bba0,3491640,Moxyland,426034,Lauren Beukes,5672a5dbffcd62de847a96572e015a62,4,"The setting is Capetown in 2018, and if this is not an alternate history tale, technology and the growth of a corporate/government alliance will have to move very quickly in the next four years. Unfortunately this may not be an alternate history tale. Every technological innovation and fascistic development Beukes brings to her story is a plausible blend of the dreams we have of a fully wired world and a worst-case scenario for the same. 
 Beukes characters are mostly in their twenties and a mix of art school graduates, upwardly mobile corporate types, hackers, and minor league revolutionaries of the Merry Prankster variety. She moves them rapidly through a world where one's identity is completely tied up with a cell phone, and the worst that can happen to you is a police-enforced disconnect. Corporations operate as city-states and rule a strictly stratified society whose members find release in their drugs of choice. Her greatest accomplishment is the slangy, hipster lingo her characters speak, a argot the reader is expected to keep up with without a phrasebook to help things along. And it works. Even when I was vague on specifics I felt I had the gist of what was going on. 
 The issues her characters face are familiar from novels without sf settings. They need money from home; they have friends who might become lovers; they might sell out to corporate money; or, their move up the corporate ladder conflicts with their links to avant garde factions of society. The story if fun and slightly dangerous, but dystopian fiction being what it is, you see serious trouble ahead. There is this sobering exchange late in the novel 
 ...any action is justified when there is a terrorist threat.\" 
 \"You just have to create your own terrorists.\" 
 ... 
 And it makes perfect sense. The process has to be managed. Fear has to be managed. Fear has to be controlled. 
 Like people.",eng,1,Tue Jun 10 09:42:52 -0700 2014
129caef4fc16b875dfd02dd1def6373f,27863881,All-New Wolverine (2015-) #1,6470937,Tom    Taylor,59717d48561cdc1b5492e48af8f702d1,5,"Laura has chosen to fill the shoes of the dearly departed Logan. She is the All-New Wolverine. She's currently working to fight off an assassin with aerial assistance from Angel. 
 Why oh why did I wait to read The All-New Wolverine? I mean I already thought Laura was awesome from her origin until now. Perhaps some of the misses swayed me or maybe it felt weird seeing her in Wolvie's colors. Whatever the reason, I was being a fool. I've read an least one issue of three of the other four X titles and this one is much better than the others. Laura is an extremely complex character who has lived a long life since she was raised from birth to be a weapon. She's kind of like Pinocchio because since her inception she has slowly become a real girl...as much of a real girl as she can be considering she has adamantium claws and a healing factor that just won't let her die. I also appreciated the use of humor in what would otherwise have been a serious and bloody issue. 
 One thing bothered me, but it has nothing to do with Laura. It has to do with the Black Vortex, the super mirror that made anyone who accepted it's power in a cosmic powerhouse. My issue is Angel looked in the mirror and was transformed, but unlike Cyclops, Iceman, and Beast he didn't give the powers back. So my concern is why is he now just a bright winged version of his prior self instead of being far more powerful than practically everyone on Earth? It will bug me if he, Kitty Pryde, and Gamora have still have the makeovers without the power. 
 All-New Wolverine is a must for any fan of Laura Kinney formerly known as X-23. If anyone wasn't a fan before, now is the time to jump on the bandwagon.",eng,15,Sun Feb 07 18:56:00 -0800 2016
9757276f42f400d97eb578d42c62d6b0,63697,The Man Who Mistook His Wife for a Hat and Other Clinical Tales,843200,Oliver Sacks,a15bc7f7c241c99b89a1fd581499f2dd,2,"I love this guy on NPR shows like Radiolab, but this book just wasn't for me.",en-US,0,Wed Jan 15 20:48:17 -0800 2014
92bb3e7bc47a423dd1674425a2bd2f73,13125947,"Reached (Matched, #3)",1304470,Ally Condie,85194d46092e4b3337acdf27b27c7533,5,"- The story is told from 3 perspectives: Xander, Cassia, and Ky. I really loved that we got to see more of Xander. 
 - The book is kinda slow, but I savored each word. It really isn't the plot that sucked me into the series, it was the characters! 
 - This is such a different kind of rebellion. It is so fresh and unique to see this kind of resolve. 
 - The love triangle is settled, but I'm not completely happy about it. I understand why it went down the way it did, but I'm still not happy. 
 - This book really made me take a deep breath and think. The gears in my head were turning the whole way through. It is kind of a somber ending. 
 - I enjoyed this book, but I think Matched is my favorite in the series. 
 - There are so many little things in the previous books that come back in this one. I must go back to read the trilogy over again to really get the connections. Some of the stuff is brilliant!! 
 - I love reading Utah Author books because things like Sego Lilies pop up, and I love that Sego Lilies play a big role in the story! Go Utah Heritage!! Random fun state fact: Sego Lilies are our state flower. 
 - The covers of the book are wonderful. They really represent Cassia's journey. I even think the covers kind of correlate with Cassia and her experience with each Society pill. 
 - I'd love to see a sort of prequel book about Cassia's Grandfather. It would be so interesting. 
 - The book is very well written. There were some really beautiful moments.","",0,Sat Jan 21 08:13:40 -0800 2012
fb4b9de8c6e1326e753a7f57430ed26b,53616,The Gourmet Slow Cooker: Simple and Sophisticated Meals from Around the World,30349,Lynn Alley,2df9b2f1dfa775ddd836d370713c62e1,5,Beautiful. Sumptuous. Only a few intense recipes - most are very easy/straightforward. A great upgrade to traditional crock-pot cooking.,"",0,Fri Jan 16 22:53:08 -0800 2009
c0e5033635081d9ec1d8936a284f70bd,15801668,The Girls of Atomic City: The Untold Story of the Women Who Helped Win World War II,166990,Denise Kiernan,ce5f87350a38d179839c49ee319b0a1c,3,"I wanted to love this book, but found it a repetitive albeit interesting story about the role of a few woman working at the Oak Ridge facility during WW-2. Although the author had access to some of them and their stories, i found her portrayal very two dimensional. I did, however, like the interplay between the role of all Oak Ridge work into the larger Manhattan project. I find it amazing that the secret of Oak Ridge was maintained by so many for such along period. A pet peeve -- the author's use of \"gotten\" throughout the book is lazy writing. Too bad.",eng,0,Thu May 22 06:47:26 -0700 2014
64ab2d3f33743a45452c7ce67462b4f2,13547381,Love Anthony,978484,Lisa Genova,d5144dd7629f920579d2396950c57871,5,"I loved this book. The pain is understandable, the healing is too. I truly enjoyed it!",eng,0,Thu Sep 25 06:13:57 -0700 2014
de651886ca066f5fd7b96dae838f6141,23480844,Firsts,9816754,Laurie Elizabeth Flynn,7a843761ba538daaca40df9f64d9eb12,5,straight into my favourite list!,eng,1,Fri Jan 08 09:01:38 -0800 2016
bfa33708b7039326617b6dfd67c31f90,107790,"Killjoy (Buchanan-Renard, #3)",6251,Julie Garwood,e47caf6844fcc1535cf4bebbfac66c18,3,"Killjoy is the third installment in the Buchanan series, and it held it's weight. I'll say that the beginning and the middle held my attention, but at the end, where things should have gone boom, it actually lost my interest just a notch. Everything wrapped up quickly, and I didn't get the intense showdown I was looking forward to. 
 That being said, if you read Mercy you're already half in love and completely intrigued by John Paul. And Avery holds her own. I like that the girl has scars and can hold her own in the stubborn wars. But I wanted more from them. I wanted to understand John Paul a little better, and I wanted to see them escape the infernos of hell, really, because I like to see my characters go through the ringer. But still, I liked John Paul, and I liked that he stepped up to the plate when it came to what was developing between him and Avery. I also enjoyed that Noah showed up again, and his back and forth with John Paul was just as entertaining as it was in Mercy. 
 All in all, it was a good entry in the series. I'll jump on to the next.",eng,0,Fri Jun 18 19:21:52 -0700 2010
2a5da95d22f40baa49c2ff99044b2a5d,18947,Jane Austen For Dummies,11389,Joan Elizabeth Klingel Ray,a69c6769ade7996aa20662ea916ed0ba,5,"This book gives a good overview of the life and times of Jane Austen in a crisp, clear, and engaging manner. It is well-organized and easy to read with illustrations and pictures where relevant, and includes a broad spectrum of subjects ranging from dancing, courtship and marriage in Regency times to authors who influenced and who were influenced by Austen. 
 There are very relevant examples from Austen's works under each topic, which makes it entertaining and understandable. The book also has discussion sections on Austen's books and film adaptations (up until 2006), and Ray does insert her views a bit here, thus breaking the instructional tone that books in the Dummies series sometimes tend to have. Initially, I was a bit skeptical on even reading a book from this series cover to cover, but I could not pass on a book by Joan Klingel Ray. Ray is a professor of English and was also the president of the Jane Austen Society of North America (JASNA) from 2000 to 2006. 
 The one thing I did not enjoy in this book was someone's inability to proofread. The book does contain a few minor errors, mostly grammatical. However, these are very minor and do not take away from the book, unless the reader is particularly picky about these things. 
 Overall, I heartily recommend this book both to the Austen newbie as well as to more experienced Janeites. However, be sure to have read all the six major works of Austen before you read this (in spite of the book telling you otherwise), as one cannot really write such a book as this without spoilers! A more detailed review is on my blog.",eng,2,Thu Mar 04 06:28:24 -0800 2010
a2ea4af46af2c48b6f8bbe83fbb230cb,24703377,"Penthouse Prince (Billionaire Dynasties, #1)",3188348,Virginia Nelson,fefdf0c3ab5e41f109d312bf7f676357,4,"This review actually go delayed a day because I wasn't sure what to say or how to rate it. I went back and forth and I think I've finally made up my mind. All else aside, this one has definitely made me think about it more than any other has for awhile. 
 I really liked Jeanie. She was strong and fought for what she wanted in life. She didn't turn down a challenge and repeatedly stepping up to the plate She was fiercely protective of her daughter and was a \"do the right thing\" kind of gal. While her judgement of how to get the right thing done wasn't always spot on - the mistakes made her human. 
 Camden was a bit of an arrogant prick at the beginning. Confident in always getting his way and willing to pay whatever it takes to get it. He gets soooo much better as the book goes on. When he firsts offers the fake fiance/marriage of convenience type of contract I almost didn't want him to be the hero. He is one of the most dynamic heroes I've seen in a long time. He was a completely different person by the end of the story, but it happened in an incredibly natural and organic way that you didn't really notice until it slapped you in the face. 
 There are a couple side storylines to give the book some depth with both their families and some serious family drama, but I liked that it didn't get dragged into the romance every step of the way. It was just presented as a way to round out the characters and show a bit about why they were the way they were. 
 *This book was received in exchange for an honest review*",eng,0,Sun Feb 01 19:40:49 -0800 2015
90c90b167dac63c0f2f504003396c6b3,11407573,"Freaks (Rizzoli & Isles, #8.5)",18149,Tess Gerritsen,8869d1165aea69bbf5ea112443719067,3,"This short story is almost fleeting, but it's entertaining enough to pass a few spare minutes. I think it took me fifteen minutes at most to read.",en-US,0,Sat Jun 11 17:39:33 -0700 2011
155cb51380393d5f1c557f72caf64e6a,32620360,Wish You Were Here,6994731,Renee Carlino,64716af4da03f6d400643ad457735897,1,"I've read this book before. It was originally called \"Me Before You\".","",0,Sat Oct 07 13:17:49 -0700 2017
d4cc2248f74ab7ea9239f19f232533bb,22107044,"Heart Recaptured (Hades Hangmen, #2)",7074846,Tillie Cole,cae5620d15e43457608bbf79ac88e81f,5,I loved the story of Lilah and Ky...,eng,0,Sun Aug 30 07:07:16 -0700 2015
099d10a71dee1843d66492489b829c45,7937843,Room,23613,Emma Donoghue,bbb0b71fe99b8aba50b460e2af392774,5,"What a unique book about an injustice to any who lose their freedom. Written from the view of a 5 year old, this shows the resiliency of the young. You don't really realize the context until you have read a bit and then it just hits you. Wonderful book.",eng,0,Sat Jul 30 15:39:38 -0700 2011
239e23e1fd2826214e33302ba5c2afb6,26093264,Throttle MC,7371255,Daphne Loveling,600c811b96fed8dd0181b7024aac0524,4,"Good book. A typical step brother romance, with the step brother being a biker.",eng,0,Mon Feb 13 17:57:56 -0800 2017
1602445ebbc9f95d608093740074960a,8740736,Ponyella,87184,Laura Joffe Numeroff,6ac35fe952c608da50153d64f616291b,2,"The Cinderella story is re-done in ponies, with a mistreated pony vying for the affection of a young girl. 
 What's good: 
 Mistreatment and overworking of animals is shown as bad, and the care of the young girl vs. that of the pony's current neglectful owner is contrasted. 
 What's not so good: 
 The \"wicked stepsister\" ponies are punished for their cruel behavior toward Ponyella, but not the owner who does actually cruel things like forcing Ponyella to haul overloaded carts, confining her in a tiny stall, etc. 
 The \"stepsister\" ponies at the end are depicted as deserving of their fates when they are sold to a bad owner who rents them out for kiddie parties.","",0,Tue Oct 20 10:22:44 -0700 2015
b411b0f123c2512e34f2cc47458bd1df,12758313,Bon Appetit! The Delicious Life of Julia Child,287339,Jessie Hartland,58f0a709279a587818b9b547be1b2198,4,"fun illustrations and endpaper. For someone I feel like I've read a lot about, I still learned from this book.","",0,Thu Jan 31 10:15:18 -0800 2013
c12fe971c2479e171853a153220f7511,28961690,"Beloved (Salvation, #1)",7753662,Corinne Michaels,7a6471c83a0a4e8574726f030de22b53,2,"Me gusto mucho los libros 3 y 4 de esta serie, asi que le tenia muchas ganas a esta historia. Buscaba algo romantico con un toque de drama que me mantuviera al tanto con la trama, pero lamentablemente nunca pude conectarme con esta pareja. 
 Pense en dejarlo pero tenia la esperanza de que mejorara a medida que leia. Una lastima porque prometia a simple vista... puede que le eche una ojeada a la segunda parte a ver como termina todo.",eng,1,Mon Apr 18 04:03:04 -0700 2016
193c35e8f5a873144ec40c2ff4e3fdb1,3486558,My Name Is Not Isabella,1470172,Jennifer Fosberry,b380d80c6336d11705eeacbd03653b73,4,"All in a days work, a child is many different women from history. My favorite part is when she chooses to be her mother. I also like that it included information on the historical women. I enjoyed this book and I feel it is a great read for young girls and even boys. There is a male version of this book that I have not read yet called My Name Is Not Alexander. The illustrations were imaginative.","",0,Fri Jan 14 23:36:36 -0800 2011
