review_id,book_id,title,author_id,name,user_id,rating,review_text,language,n_votes,date_added
a434603f743ba2c80dedabe31e17feac,18335634,"Clockwork Princess (The Infernal Devices, #3)",150038,Cassandra Clare,a82ebd2d79a0828b04effbd989ed4df4,5,crying all the tears... feeling all the feels Jem 5ever,eng,1,Thu Mar 06 13:16:29 -0800 2014
6fc2e73390ede6bd073ce7061d92ded8,18079468,"Tragic Love (Sulfur Heights, #2)",7103293,M.S. Brannon,ebe6b87320b16935edea58dd435ac2ab,5,i can not believe how this book ended but im looking forward to next ones. Love this series,eng,1,Sat Jan 04 14:46:28 -0800 2014
b179bd15c794d813d4dddffcfabadefe,7264960,Missing You,1261540,Louise Douglas,26d720ae776feacc52ef7d432f16ccf4,2,"Well... At first I thought this is one of those wannabe Sparks books. But at the end it was just ok. 
 I mean, story was fine, but something was missing, something deeper to make me fall into this story. 
 And this is, for me, one of those books where title doesn't have anything to do with story. 
 So, I'm giving you 2 stars.",eng,1,Fri Apr 04 07:53:39 -0700 2014
fdfb3e0b47c21b4e24354f901fe2f469,126057,The Double Helix: A Personal Account of the Discovery of the Structure of DNA,14313,James D. Watson,38c1796d29e14c51969ca305f644c4d0,4,I don't read a lot of non-fiction but Watson's telling of the discovery of DNA reads more like a thriller. Very interesting.,en-GB,0,Fri Jun 25 10:31:19 -0700 2010
d4e7a035c1597a7eed75bd69651644db,852470,"I'd Tell You I Love You, But Then I'd Have to Kill You (Gallagher Girls, #1)",56224,Ally Carter,eae16d0c1f4777d13939a8e5e4abdb38,4,"The first few chapters were suspiciously Harry-Potter-ish (especially the part where Prof. Solomon makes his entrance), but it got better after that. Girl spies are hot. :) 
 I was, however, irked by the fact that Cammie and gang were picked for everything first. This could be due to the fact that Cammie's mother is the headmistress, but if it is not, it is irritating.",en-US,0,Sun Apr 27 16:37:05 -0700 2008
c064c953fc0213490efce958c18a5cf0,7937843,Room,23613,Emma Donoghue,6d5848a0f2f530b459f2981bef4758a0,4,Haunting. The ending is a bit of a let down. But worth a read regardless.,eng,0,Tue Mar 12 17:46:17 -0700 2013
914aa21b45f366ce643deff58d4e7625,581294,Pompeii,575,Robert   Harris,414854ccbe367d9cb5a97d159b40cf2f,3,"Entertaining, full of fun facts about Vesuvius and ancient Rome, a little lacking in character development and story flow, chock full of anachronisms in speech and gesture, but otherwise a decent adventure type read. It was nice to read something a little bit different in setting and character than the usual scientific discovery adventure. It got me curious enough about Mount Vesuvius and the 79 A.D. eruption that I just had to look it up on Wikipedia. I would love to visit Pompeii someday myself. History is fun!",eng,0,Sun Apr 17 11:07:51 -0700 2011
3412b2dfaad09cd28ac3d84c0e753a6d,30244714,Adulting 101,5050492,Lisa Henry,498675afe38beaabd4cddb50dfd9893a,3,"3.25 stars -- low angst read with some really funny moments. I had a hard time connecting a little with Nick, even though I should have because of shared traits. What threw me off the most was the third person present tense; it was carefully done, but not as immediate as I expected. A fun, light hearted read I'm glad I got to enjoy.",eng,0,Sat Aug 13 00:30:43 -0700 2016
967e5d73fa310405e66af9c7c2bfd4b8,23007818,"Trouble on Reserve (The Hollows, #10.5)",17054,Kim Harrison,dbcbaab418b209125605737203dcd100,5,"This is a really great short set after EA, the only problem is it leaves you desperate for more! 
 Thank you Kim for this great freebie.",eng,0,Wed Mar 20 08:23:27 -0700 2013
dc15b92bcbaa795133fa451f77e91522,2210629,Wasteland Book 2: Shades of God,12863,Antony Johnston,0acc575c87fc68ba75011e1ea3d04d3d,3,"I agree with the other reviews on here that this book was a little slow. Especially when compared to the first volume. Although I think it has set up the politics of the world well and if the pace picks up in the next volume, I'm sure the world building in this book will feel necessary.","",0,Thu Jul 11 08:01:03 -0700 2013
d282bcca44d15f01054bf653f1f576f4,28765613,Small Great Things,7128,Jodi Picoult,9434e24760e6581dab0238d9971b4cf9,4,"A bit contrived and convenient at times, with some unrealistic dialogue, but a timely and worthy story in general.",eng,0,Sun Mar 12 00:41:32 -0800 2017
f995e32beec8a813f505d2606ee56abb,7937843,Room,23613,Emma Donoghue,8e4573b94871e75398528196a9f39dff,3,"I know a lot of the criticism of this book comes from the fact that it was told from the POV of a five year old. And I can understand the frustration that it might incur. Honestly, there are some things that I wish that I could have gotten his mother's perspective (the backstory, her abuse, and her inevitable suicide attempt . 
 But I feel like people are kind of missing the POINT of showing things from Jack's point of view. As a five year old, he gives us a much starker view of the world. And you learn a lot more about the transitions from him. His mother already lived in the world, she wasn't trapped forever, just a long time. 
 But Jack didn't know ANYTHING outside that little room. It was his entire world, a place where he felt safe, and then he was thrown into an entirely different situation, with people who didn't understand him at all. Even his mother had trouble realizing why he didn't think that the outside world was better. 
 The parts I loved best? Probably when people interacted with Jack with understanding. I LOVED the part when he talked to Officer Oh. I think it was such a great exchange between the two of them. She never got impatient with him, she always tried to talk to him in ways he would understand, tried to ask him questions so that he would know how to answer them. And the fact that the other office was so willing to give up on Jack and try something else just makes it that much more poignant. 
 I liked Jack and his Grandmother, too. She was patient, understanding, and while there were a few times she lost her temper with him, she tried to be patient. At one point, he won't play on the playground because there are other kids, so she takes him early in the morning, when no one is there, to try and get him acclimated to the outside world. 
 While Jack's manner of speech didn't particularly bother me, I could see where it could get annoying. Also, while I like seeing things from Jack's eyes, I don't think Donoghue was an AMAZING writer. Good, yes, I enjoyed the book, but I didn't have to rush to the end. I think that I kind of got bored of Room scenes before she intended me to, but inevitable it worked out ok. She didn't spend the whole time in Room, which is what I expected. 
 Honestly, I liked the book, but I can easily she where people would get annoyed with it. If you've read other books that have taken a weird POV, then I would pick this book up.",eng,0,Fri Mar 29 05:56:43 -0700 2013
6f05ef2b0e787f2ab14820f0edb953a0,6352093,"The Girl Who Kicked the Hornet's Nest (Millennium, #3)",706255,Stieg Larsson,92c53064e2772bf057e40414d4f78caf,4,"I have really been trying to understand why I like these three books. Maybe my opinion is swayed because the author died before they were published. Maybe I'm just intrigued with the image of Stieg delivering these three HUGE volumes to his publisher (very strange to have all three of them written at once) and then collapsing with a heart attack. But whatever the reason, I am willing to forgive clunky dialog (reminds me of exchanges on Dragnet), confusing, unpronounceable names with unfamiliar symbols over the vowels, quick little deviations from the plot to make sure that us foreigners understand the political make-up of Sweden and some unresolved storylines (for god's sake what about the sister!!!!). 
 I finished the book wondering if the author planned to write more about his compact, socially awkward, sexually charged, heavily tattooed heroine. (Spoiler alert) For one thing, Lisbeth is still alive at the end of this book and Blomkvist is about to start up a relationship while just seeming to realize that he can't live without Berger. But I just have to put my wondering aside and accept that that's all. And it was the kind of read that makes it worth hefting a 600 page book everywhere you go (no I don't have a kindle and besides, there is no kindle edition of this book right now.)",en-GB,1,Wed Mar 25 08:46:04 -0700 2009
8d76abd552d5149664732e0b663bb643,13539044,The Silver Linings Playbook,1251730,Matthew Quick,27b8431570acacff2bb6a3d58e8b51ae,3,"It was alright actually, not quite as good as I expected.",eng,0,Fri Apr 26 07:00:01 -0700 2013
8b4b5a4ba3bce6d8a34cebd26503b8e8,21373798,Black Lake,7254342,Johanna Lane,681a8c0d2b83d0d2665bc3b3542c1662,3,"Black Lake, Johanna Lane 
 Little, Brown & Company 
 978-0-316-22883-1 
 Submitted by the publisher 
 $25.00, 224 pgs 
 \"...there had to be unsaid things between husbands and wives, and he had learnt that, though these were the things that saved you, they separated you too.\" - John Campbell 
 The main character in Black Lake by Johanna Lane is not a person; it's a house. But the word \"house\" doesn't do justice to Dulough. A castle estate set on the Irish cliffs of the North Atlantic, Dulough is a concept. The Campbell family, father John, mother Marianne, and the children Katherine and Philip, live at Dulough (\"black lake\" in Irish). It has been in the Campbell family for 150 years. When funds run precipitously low due to, it seems, general lassitude on John's part, he does the unthinkable: he allows the government to run Dulough as a museum for tourists, which will pay for needed repairs to the property. In return, John receives a salary for the first time in his life and the government builds a small cottage for the family alongside the caretaker's cottage. When the \"upstairs becomes the downstairs\" neither is on sure footing. The ensuing turmoil allows the existing faults in all of these relationships to shift, with tragic consequences. 
 Fast forward six months: twelve-year-old Katherine Campbell finds herself locked in the top floor ballroom of Dulough with her mother Marianne. Marianne is the one with the key but she doesn't want to leave. She has, however, taken leave of her senses. 
 \"It was after the snow that the mother began to talk about the girl's brother as if he were still with them. One morning, as the girl did her lessons, her mother said, 'I'd like you two to have this finished by lunch.' 
 The girl's heart jumped. But it was a tiny word, two - a slip of the tongue, perhaps.\" 
 Moving back and forth in time, between an omniscient narrator and the members of the Campbell family, has the same result as a game of telephone. Each narrative includes the same ingredients, the same information, but the different perspectives become a disjointed truth. The character on whom the future of this family hinges is the last to speak. Marianne Campbell will fill in the blanks left by her children and an obtuse, ineffectual husband. 
 Black Lake is author Johanna Lane's debut novel. She grew up in Ireland and now makes her home in New York City. Lane is either an empath or else she remembers better than most how it feels to be a child. She is a genius at conveying both the brutal, inexorable logic and the free-association of a child's mind. \"The men were older than his father; they had deep lines in their faces. Like valleys, Philip thought. He imagined tiny glaciers settling into their skin, the ice cracking and expanding. They had been doing glaciated valleys in Geography.\" And this: \"He thought about the man who hadn't flinched when Mrs. Connolly poured tea on the back of his hand. He wouldn't have much tolerance for children who didn't do what they were told. Philip imagined the man pouring teapot after teapot onto his outstretched hands. And him not being allowed to flinch, either.\" 
 The Irish countryside is also a character in this tale, the environment wild and formidable, the atmosphere thick with foreboding. Lane also possesses a gift for description. \"The wind was already in the gardens, the tops of the trees bent as if they were straining to talk to each other and straining to hear.\" And this: \"A ring of yew trees encircled the churchyard, a sign that his family believed they were going to heaven. But the trees had the opposite effect. It was dark under their canopy, even in the middle of the day. The roots curled themselves into the graves and the branches twisted into the contortions of the wind.\" 
 Like all good Irish tales, the theme of social justice haunts the place. During her turn, Marianne, upon discovery of the family diaries John has hidden away, will tell you the history. 
 \"John had never thought of his family as privileged. They had lived in a grand house, yes, but they'd had no luxuries. And yet he realized now that he had been spoilt. He had been brought up to think that there would always be enough money, magically there, because people like them always had enough. It was unthinkable that they would have to compromise themselves to accept a job they didn't want, a job that might take them away from Dulough, a patch of Ireland they had a right to.\" 
 Black Lake is ready to inherit a place amid the long and strong tradition of family dramas set in the great Gothic homes of Irish history. 
 Bonus: you can check out Johanna Lane's photographic inspiration for Black Lake on her Pinterest page.","",0,Tue Mar 11 15:40:30 -0700 2014
1496b610638d694f9120d249fa7093c9,34232939,"Tropical Wounded Wolf (Shifting Sands Resort, #2)",13703060,Zoe Chant,87f36032c60e88679e6752f5e1ec1da7,5,"ARC - I voluntarily offered to review this book and my opinions are honest! 
 Great Book! 
 After so many years in capitivity, Neal did not know what to do with himself. 
 He felt lost + out of touch with the world. 
 Mary came to the resort just looking for a vacation. 
 She did not know that she would meet her mate, and that her life would be in danger. 
 When danger showed up at the resort, Mary + Neal found out what they were made of. 
 They both meet the challenges head on. 
 As I said: Great read!",eng,0,Sun Feb 12 13:56:30 -0800 2017
f921b7ab42cce6a31915782df4ad9fe7,32703721,Not So Little Green Man,1709139,Celia Kyle,109a4d2895bb070b7b2a48e8e0379269,5,"I received this book as an ARC for a voluntary review. 
 In this book we meet Jassa Marizen and Vroe of Vialea. When this book opens up we find Jassa running from the police of the time on Earth. Because she has not found an Earth mate they wish to impregnate her and then when the baby is born take it from her. Being an orphan herself Jassa isn't willing to do this so she signs up for Celestial Mates. Now if she can just get to their ship she will be able to have what her heart desires most a mate and a baby that she can keep. What happens though when she finds out the planet she is going to isn't all she thought it would be? Will she run back to the familiar even though it has it problems or will she stay and fight? 
 Vroe knows that his plant is different then what Jassa knows but he is sure if he can just be with his mate he can show her the wonders of it. What happens is not something he suspects his firez is coming on faster than he thought. He believes that he will hurt his new mate if he touches her the way he wants so he distances himself as much as he can from her. This isn't something either or them want but what can he do? Will he open himself fully to his mate or will he drive a wedge between them that he isn't sure he can repair? 
 This is a great story about finding the perfect love for you and making sure that you fight for the right to keep it. This book has many twists and turns to it that I don't want to ruin for any other readier. So I will say this book will have you hooked from the first word to the very end. I would recommend this book to anyone and everyone.",eng,0,Sun Oct 23 09:55:39 -0700 2016
d7bf375aebcce2feacbdcbdc1179b1c4,4758093,"L.A. Candy (L.A. Candy, #1)",1980985,Lauren Conrad,7096f2077b712e9657b368eb6791602a,3,Cheesy ready but it kept me comparing it to The Hills and I couldn't stop. I'm going to read her other books eventually.,en-US,0,Wed Mar 04 12:56:06 -0800 2009
858defc891b6d740f9c883fb584fa83f,23625549,"When a Scot Ties the Knot (Castles Ever After, #3)",2752928,Tessa Dare,d68c346146772c53f6ba1423cc7c2979,4,"I love Maddie and Logan, and how they each have to grow, individually and together. I love Maddie's job as a science illustrator (Dare's science ladies are my faves -- I also love Minerva from A Week to Be Wicked). I love the relationship between Logan and his soldiers (Grant especially ). I love the relationship between Maddie and her aunt Thea (totally got teary-eyed when Thea talked about socially non-conforming women making their own space for themselves). And I love the lobsters. :)",eng,0,Mon Oct 02 18:18:15 -0700 2017
70c73b8559eba8152fecfb2ade1f7110,24703377,"Penthouse Prince (Billionaire Dynasties, #1)",3188348,Virginia Nelson,4f6a8cc7d4c354088086bc0d07729038,2,"I skip and skim through out this book. 
 This book isn't bad, but it had failed to hold my interest for very long. I did skim to the end though. 
 The conflict seem forced and emotion didn't feel genuine and characters didn't come alive.",eng,0,Fri Oct 09 02:47:32 -0700 2015
9906be79e5c4434f21df47abf688b757,17252987,Grace and Mary,41858,Melvyn Bragg,74d77b4534df070514af72df0559c06f,5,Find Dementia Awareness books in Townsville,en-GB,0,Thu Mar 19 19:39:13 -0700 2015
25e3fff25b7767c75342ef882c688451,7937843,Room,23613,Emma Donoghue,8dfddae02feb4bc0559ec9f98699a73a,5,I read this book in two days so I liked it a lot. Jack is frustrating at times but that just made me understand the roller coaster that Ma went through.,eng,0,Mon Oct 19 11:56:17 -0700 2015
3312fadc6757c84f1d7f6ba8ccb84569,263145,"Vampire Knight, Vol. 1 (Vampire Knight, #1)",153732,Matsuri Hino,fe19a8eca4e1caaaad3f81cebea44ba7,3,"Wonderful artwork, plot and originality. It makes me want chocolate.",eng,0,Thu Jul 25 06:18:14 -0700 2013
9fdcb029e97cc207c5609110a6905a8d,25451555,"Saga, Vol. 5 (Saga, #5)",24514,Brian K. Vaughan,bb70d3c2dc9ef9b0d5634f6f7b976f12,5,I forget in between volumes how much I love this comic.,eng,0,Fri May 27 18:16:41 -0700 2016
6ffc5887f027ccf938daee1535217fb2,18691009,"The Scorched Earth (The Chaos Born, #2)",20030,Drew Karpyshyn,dd0a518c3d7bf43a505da2a81da95365,4,"The rise and fall of Red Bear. 
 While Drew Karpyshyn follows the same structure laid out in the first Chaos Born book, he also mixes it up a bit and offers the reader a more focused and well rounded book. 
 In book one, we watched as individuals, driven by their own stories, came together to form a powerful group in the face of a growing enemy. And by the end of that book we saw the newly formed group defeat a powerful dragon, only to press on towards the greater threat that lay beyond. Here, in book two, we see much of the same but on a larger scale. In this offering Drew shows that to defeat the growing threat the small group must become a larger community. With that said, we watch as clans, tribes, and societies pick sides for the coming battle. But where book one focused on a small group coming together, and the story in book two involves larger groups joining the fight, Drew Karpyshyn has also decided to make the story more focused and has given us a more in-depth view of one of the main characters. 
 Norr, he was the big, burly, protector of the powerful Scythe in book one, but in book two he is the driving force for the main story. No longer a background character, or a crutch for Scythe's evolution, he becomes a powerful force in the groups dynamic. His journey is one that most will never have seen coming, a journey that will make the man a hero, a villain, a savior, and a martyr. And in the end, his journey will be the catalyst for the third installment. 
 Overall the second book is a vast improvement over the first. We watch as Drew Karpyshyn gets back to the core of what makes him a powerhouse writer, and find that his ability to delve into a character's soul is still a powerful tool in his control. 
 Here, there are no major complaints to report. Although the book could have used a little more balance between the good and evil sides of the larger tale, and a little more of a climatic ending, most will see that the second book offers quite a bit more than the first. The more focused tale, and the more edited length, makes the second book a better read than the first. 
 Four Stars. 
 *I received this book in ARC in exchange for an honest review.",eng,4,Sun Aug 10 10:42:43 -0700 2014
1c3fc20accce38ce7bcad29218e81ca1,30363103,I'll Take You There,3505,Wally Lamb,f16061e468fdf81f046a82c3d9aae621,3,"I am a huge fan of Wally Lamb from his earlier masterpieces (I Know This Much is True and She's Come Undone). I continue to pick up his books simply due to the fact that he's the author. Perhaps I should pay more attention to the plot. While I enjoyed the movie theater setting, I didn't fully embrace the ghosts. I very much liked the blog article towards the end written by the daughter. My favorite chapter!",eng,2,Tue Oct 25 12:57:50 -0700 2016
25ae546894ea5d7e1eba3df2dc7aabe4,2856001,Bounce Back Book,117096,Karen Salmansohn,6bec7c03218c4535d560c0f145ffde65,4,Good for a time of need!,"",0,Mon Nov 02 06:35:30 -0800 2009
0cda64c7f6118f561e582afbaff200ce,21795909,Carta a D.: História de um Amor,481508,Andre Gorz,77e61d7d89b2fdb5057f6ea07d3f7387,4,"oh, the feels.",por,0,Mon Sep 28 19:16:58 -0700 2015
2f4fef5ef7f3a71f1bc51a4bae870dd5,23341863,"Last Chance Hero (Last Chance, #9)",4423779,Hope Ramsay,88e4407451355899b43ed6f6c3014623,3,"Timing is everything... 
 Ross Gardiner is back in town after his divorce and making great strides in rebuilding his future. 
 Sabina Grey has spent most of her adult life trying to overcome a family tragedy that still governs every decision she makes. 
 With so many obstacles in their path, any type of relationship between the two seems completely impossible. And impossible really seems to be the order of the day. 
 The old adage \"two steps forward, one step back\" is really \"one step forward, three steps back\" in this second-chance romance that is steeped in over-the-top drama. The story is well-written with characters that have distinct and likable personalities. But, in saying that, the storyline seems to be a relentless string of obstacles and misunderstandings that becomes overwhelming after a while. With a number of sub-plots vying for attention, I was afraid to turn the page because I knew there was going to be something; something new, unwanted and/or unpleasant that would put another spanner in the works for Ross and Sabina. 
 With a non-cliffy ending, there were no loose ends and the storyline was tied up most satisfactorily. ~ Diane, 3.5 stars 
 ~~~ 
 This is one of those reviews where I had to delete the first couple of tries. I don't want to just jump in with negativity. This book deserves more than that at least. It had solid writing, and a good plot line. 
 I loved the idea of the sister being secretly in love with the other sister's boyfriend, and the idea of small town meddling and gossip pushing people together who just aren't meant to be. I have a weakness for sexy firemen, and I love when things come together for a happily ever after. The twist at the end was pretty great. I saw it coming, but still, I liked the way it was written, and I loved who the hero actually was at the end. There were just a few things that just made me not love this book. 
 For one, there was not as much character depth as I wanted there to be. I heard inside their heads, knew what they were thinking, and still they felt very shallow. The small town gossips and meddlers were mentioned by name, and then thrown in when needed for a quick plot device, but they weren't characters all on their own. I felt almost intruded on when they stepped into the story, as if they didn't really belong there. I wish they could have been stronger characters. 
 This book was not at all bad, I enjoyed reading it well enough. It just wasn't great either, and that was disappointing because it wouldn't have taken much to push it over that line. ~ George, 3 stars",eng,4,Tue Jul 21 11:05:11 -0700 2015
fb86f1a2f4dea3a0e0e7e2bdd6c78847,18914978,Where Is My Home?,7153266,Tali Carmi,e4983c4e5dc2073a7f689c350439fc2f,4,"It's summer vacation and Terry Treetop is in his treehouse when he sees a butterfly. He chases it into the woods and gets lost and hungry. He meets several new friends on his journey. But, will they be able to help him get home?",eng,0,Sun Mar 09 12:15:27 -0700 2014
2200416d7a01dd0c8880c5116d87eb7c,8015504,"Deceived (Star Wars: The Old Republic, #2)",32912,Paul S. Kemp,b8f07f959874a097014b25b99e1ba0d0,3,"\"Gritty, dark, real with a loving Sith - what's going on?\" 
 It would be nice to read a Star Wars novel that didn't either; tie in with the movies or games. Having played The Old Republic MMORPG at launch, I get this story. It really does two things, introduces the different types of classes to the reader/gamer (aka - Trooper, bounty hunter, Sith warrior, scoundrel etc) and also the main characters in the game. That being, Darth Malgus (Sith warrior), the Emperor, Satale Shan (Jedi Master) etc etc. From a literacy point of view, it must have been difficult to be creative and bring your own twist to such a novel, when you are hamstringed by the lore, canon and beyond that, a game. Having said that, Deceived ties in well with one of the trailers that was released before came out (http://www.youtube.com/watch?v=c4iL5u...). The beginning is rather explosive. From then on however, the novel fades to smaller embers of that explosiveness. 
